category,question,optionA,optionB,optionC,optionD,correct,image,explanation
Flight Plan,"In the event of a delay of a controlled flight,the submitted ATS flight plan should be amended or canceled and a new ATS flight plan submitted when the delay is in excess of:",60 minutes of the estimated time of departure.,30 minutes of the estimated off-blocks time.,60 minutes of the estimated off-blocks time.,30 minutes of the estimated time of departure.,2,,
Flight Plan,Pilots of controlled flights are requested to inform the appropriate ATS whenever the average TAS at cruising level between reporting points varies or is expected to vary from the TAS given in the flight plan by:,7%,3%,5%,2%,3,,
Flight Plan,During an IFR flight TAS and time estimate for the next reporting point appear to deviate from the data in the flight plan. In order to conform to PANS-RAC the deviations should be reported to ATC as soon as they are in excess of:,TAS 5% and time 2 minutes.,TAS 10 kts and time 2 minutes.,TAS 5 kts and time 5 minutes.,TAS 3% and time 3 minutes.,1,,
Flight Plan,"In the event that a controlled flight inadvertently deviates from its track given in the current ATS Flight Plan,action should be taken in order to:","Maintain VMC,wait for instructions from the appropriate ATS unit.","Climb or descent by 500 ft,inform the appropriate ATS unit.",Notify the appropriate ATS unit immediately notifying the new track and to comply with instructions from ATS.,Adjust the heading of aircraft to regain track as soon as practicable.,4,,
Flight Plan,Which of the following statements regarding filing a flight plan is correct?,A flight plan should be filed when a national FIR boundary will be crossed.,Any flight plan should be filed at least 10 minutes before departure.,In case of ATFM (Air Traffic Flow Management) the flight plan should be filed at least three hours in advance of the EOBT.,A flying college can file repetitive flight plan for VFR flights.,3,,
Flight Plan,"For flights in accordance with IFR within advisory airspace,an ATS Flight plan:",shall be submitted. There is no obligation to report changes.,does not have to be submitted.,"may be submitted at the pilot's discretion. In case a flight plan is submitted,all changes shall be reported as soon as practicable to the appropriate ATS unit.",shall be submitted. Changes to the flight plan have to be reported.,4,,
Flight Plan,A current flight plan is a:,flight plan in the course of which radio communication should be practised between aeroplane and ATC.,filed flight plan with amendments and clearance included.,filed flight plan.,flight plan with the correct time of departure.,2,,
Flight Plan,"You have a flight plan IFR from Amsterdam to London. In the flight plan it is noted that you will deviate from the ATS route passing the FIR boundary Amsterdam/London. The airway clearance reads ""Cleared to London via flight planned route"". Which of the following statements is correct?",It is not allowed to file such a flight plan.,You will get a separate clearance for the deviation.,The filed deviation is not accepted.,The route according to the flight plan is accepted.,4,,
Flight Plan,"When an ATS flight plan has been submitted for a controlled flight,the flight plan should be amended or cancelled in the event of the off-block time being delayed by:",45 minutes or more.,30 minutes or more.,60 minutes or more.,90 minutes or more.,2,,
Flight Plan,"In the ATS flight plan item 15,it is necessary to enter any point at which a change of cruising speed takes place. For this purpose a CHANGE OF SPEED is defined as:",20 kts or Mach 0.05 or more.,20 km/h or Mach 0.1 or more.,10% TAS or Mach 0.05 or more.,5% TAS or Mach 0.01 or more.,4,,
Flight Plan,Given:<br>Cruise: FL370<br>Mach: 0.74<br>OAT: -47°C<br><br>The TAS is:,428 kts,434 kts,415 kts,424 kts,2,,
Flight Plan,Minimum planned take-off fuel is 160 kg. This amount includes a fuel reserve which equals to 30% of the trip fuel. Assume the groundspeed on this trip is constant. When the aeroplane has done half the distance the remaining fuel is 70 kg. Is diversion to a nearby alternate necessary?,"Diversion to a nearby alternate is not necessary,because it is allowed to calculate without reserve fuel.","Diversion to a nearby alternate is necessary,unless the captain decides to continue on his own responsibility.","Diversion to a nearby alternate is necessary,because the remaining fuel is not sufficient.","Diversion to a nearby alternate is not necessary,because the reserve fuel has not been used completely.",3,,
Flight Plan,"An aircraft is in cruising flight at FL095 and TAS 155 kts. The pilot intends to descend at 500 ft/min to arrive overhead the MAN VOR at 2,000 ft (QNH 1030 hPa). The TAS remains constant in the descent,wind is negligible,temperature standard. At which distance from MAN should the pilot commence the descent?",45 NM,41 NM,38 NM,48 NM,2,,
Flight Plan,The still air distance in the climb is 189 Nautical Air Miles (NAM) and time 30 minutes. What ground distance would be covered in a 30 kts headwind?,188 NM,193 NM,174 NM,203 NM,3,,
Flight Plan,"During a flight the fuel indicators show that the remaining amount of fuel is 100 lbs after 38 minutes. The total take-off fuel at departure was 160 lbs. For the alternate fuel,30 lbs is necessary. The planned fuel for taxi was 13 lbs. Final reserve fuel is estimated at 50 lbs. If the fuel flow remains the same,how many minutes can be flown to the destination with the remaining fuel?",44 minutes.,12 minutes.,63 minutes.,4 minutes.,2,,
Flight Plan,"An aircraft is flying at MACH 0.84 at FL330. The static air temperature is -48 °C and the headwind component 52 kts. At 1338 UTC the controller requests the pilot to cross the meridian of 030°W at 1500 UTC. Given the distance to go is 570 NM, the reduced Mach number should be:",0.80,0.72,0.78,0.76,1,,
Flight Plan,For a planned flight the calculated fuel is as follows:<br><br>Flight time: 3 hrs 6 min<br>Taxi fuel: 8 kg<br>Block Fuel: 118 kg<br><br>Reserve fuel is 30% of the Planned Trip fuel. How much trip fuel should remain after 2 hours flight time?,30 kg.,45 kg.,27 kg.,39 kg.,1,,
Flight Plan,"In the cruise at FL155 at 260 kts TAS,the pilot plans for a 500 ft/min descent in order to fly overhead MAN VOR at 2000 feet (QNH 1030). TAS will remain constant during descent,wind is negligible,temperature is standard. The pilot must start the descent at a distance from MAN of:",130 NM,140 NM,120 NM,110 NM,3,,
Flight Plan,For a planned flight the calculated fuel is as follows:<br><br>Flight time: 2 hrs 42 min<br>Taxi fuel: 9 kg<br>Block Fuel: 136 kg<br><br>Reserve fuel is 30% of the Planned Trip fuel. How much trip fuel should remain after 1 hr 30 min of flight time?,25 kg.,43 kg.,54 kg.,33 kg.,2,,
Flight Plan,"After flying for 16 min at 100 kts TAS with a 20 kts tailwind component,you have to return to the airfield of departure. You will arrive after. (Note: include a standard rate turn of 3°/sec in your calculations)",21 min.,25 min.,11 min 40 sec.,17 min.,2,,
Flight Plan,"You are flying a constant compass heading of 252°. Variation is 22°E,deviation is 3°W and your INS is showing a drift of 9° to the right. True track is?",224°,280°,262°,242°,2,,
Flight Plan,"An aircraft flying at 7 500 ft is cleared to descend to be level at 1 000 ft,6 NM before reaching a beacon. If ground speed is 156 kts and Rate of Descent is 800 ft/min,how many miles before the beacon should descent begin?",15.0 NM,11.1 NM,27.1 NM,30.2 NM,3,,
Flight Plan,"Flight planning chart for an aeroplane states,that the time to reach the cruising level at a given gross mass is 36 minutes and the distance travelled is 157 NM (zero-wind). What will be the distance travelled with an average tailwind component of 60 kts?",193 NM,128 NM,228 NM,157 NM,1,,
Flight Plan,"A multi engine piston aeroplane is on an IFR flight. The fuel plan gives a Trip Fuel of 65 US gallons. The alternate fuel,final reserve included,is 17 US gallons. Contingency fuel is 5% of the Trip Fuel. The usable fuel at departure is 93 US gallons. At a certain moment the fuel consumed according to the fuel gauges is 40 US gallons and the distance flown is half of the total distance. Assume that fuel consumption does not change. Which statement is right?",At departure the reserve fuel was 28 US gallons.,At destination the required reserves remain intact.,The remaining fuel is not sufficient to reach the destination with reserves intact.,At the destination there will still be 30 US gallons in the tanks.,3,,
Flight Plan,"An aeroplane flies at an airspeed of 380 kts. It flies from A to B and back to A. Distance AB = 480 NM. When going from A to B,it experiences a headwind component = 60 kts. The wind remains constant. The duration of the flight will be:",2 hrs 35 min,2 hrs 10 min,3 hrs 00 min,2 hrs 32 min,1,,
Flight Plan,For a planned flight the calculated fuel is as follows:<br><br>Flight time: 2 hrs 42 min<br>Block Fuel: 136 kg<br>Taxi fuel: 9 kg<br><br>Reserve fuel is 30% of the Planned Trip fuel. How much trip fuel should remain after 2 hrs of flight?,25 kg,33 kg,97 kg,39 kg,1,,
Flight Plan,An aircraft flight planning chart states that the time to reach FL190 at a given gross mass is 22 minutes with a still air distance of 66 NM. What will be the distance travelled with a average headwind component of 35 kts?,79 NM,85 NM,53 NM,61 NM,3,,
Flight Plan,For a planned flight the calculated fuel is as follows:<br>Trip fuel: sufficient for a planned flight time of 5 hrs 10 min<br>Reserve fuel: 30% of the planned trip fuel<br>Start up and taxi fuel: 25 kg<br>Block Fuel: 645 kg<br><br>The remaining flight time to destination is 1 h 50 min. The minimum fuel aboard to cover the rest of the flight is:,169 kg,337 kg,220 kg,312 kg,4,,
Flight Plan,A sector distance is 450 NM long. The TAS is 460 kts. The wind component is 50 kts tailwind. What is the still air distance?,414 Nautical Air Miles (NAM).,511 Nautical Air Miles (NAM).,406 Nautical Air Miles (NAM).,499 Nautical Air Miles (NAM).,3,,
