category,question,optionA,optionB,optionC,optionD,correct,image,explanation
Flight Plan,Given:<br><br>Distance A to B: 3 060 NM<br>Mean ground speed OUT: 440 kts<br>Mean ground speed BACK: 540 kts<br>Safe Endurance: 10 hours<br><br>The time to the Point of Safe Return (PSR) is:,5 hours 45 minutes.,5 hours 20 minutes.,5 hours 31 minutes.,3 hours 55 minutes.,3,,
Flight Plan,"Given:<br><br>Distance from departure to destination: 270 NM<br>True track: 030°<br>W/V: 120/35<br>TAS: 125 kts<br><br>What is the distance and time of the PET from the departure point?","Distance: 130 NM; Time: 68 min.","Distance: 141 NM; Time: 65 min.","Distance: 141 NM; Time: 68 min.","Distance: 135 NM; Time: 68 min.",4,,
Flight Plan,Given:<br><br>Distance from departure to destination: 150 NM<br>Safe Endurance: 3.2 hrs<br>TAS: 90 kts<br>Ground speed out: 100 kts<br>Ground speed home: 80 kts<br><br>What is the distance and time of the PSR from the departure point?,"Distance: 71 NM;Time: 47 min.","Distance: 8 NM;Time: 5 min.","Distance: 67 NM;Time: 50 min.","Distance: 142 NM;Time: 85 min.",4,,
Flight Plan,"An aircraft takes-off from an airport 2 hours before sunset. The pilot flies a track of 090° (T),W/V 130°/20 kts,TAS 100 kts. In order to return to the point of departure before sunset,the furthest distance which may be traveled is:",84 NM,97 NM,115 NM,105 NM,2,,
Flight Plan,"The distance from A to B is 2368 NM. If outbound ground speed is 365 kts and homebound ground speed is 480 kts and safe endurance is 8 hrs 30 min,what is the time to the PNR?",190 minutes.,290 minutes.,219 minutes.,209 minutes.,2,,
Flight Plan,Given:<br><br>Distance from departure to destination: 140 NM<br>GS Out: 90 kts<br>GS Home: 80 kts<br><br>What is the distance of the PET from the departure point?,124 NM,70 NM,66 NM,74 NM,3,,
Flight Plan,Given:<br>Course A to B: 088°(T)<br>Distance: 1 250 NM<br>Mean TAS: 330 kts<br>Mean W/V: 340°/60 kts<br><br>The time from A to the PET between A and B is:,1 hour 39 minutes.,2 hours 02 minutes.,1 hour 54 minutes.,1 hour 43 minutes.,4,,
Flight Plan,Given:<br><br>Distance from departure to destination: 360 NM<br>Safe Endurance: 4.5 hrs<br>True Track: 345°<br>W/V: 260/30<br>TAS: 140 kts<br><br>What is the distance of the PSR from the departure point?,307 NM,154 NM,52 NM,185 NM,1,,
Flight Plan,"Given:<br><br>Distance A to B: 2484 NM<br>Mean ground speed OUT: 420 kts<br>Mean ground speed BACK: 500 kts<br>Safe endurance: 08 hrs 30 min<br><br>The distance from A to the point of safe return (PSR) is:",1 630 NM,1 940 NM,1 736 NM,1 908 NM,2,,
Flight Plan,Given:<br><br>Distance from departure to destination: 435 NM<br>GS Out: 110 kts<br>GS Home: 130 kts<br><br>What is the distance of the PET from the departure point?,236 NM,368 NM,199 NM,218 NM,1,,
Flight Plan,Given:<br><br>Distance from departure to destination: 3 000 NM<br>Safe endurance: 8 hrs<br>TAS: 520 kts<br>Ground speed out: 600 kts<br>Ground speed home: 440 kts<br><br>What is the time of the PSR from the departure point?,203 min,173 min,117 min,277 min,1,,
Flight Plan,Given:<br><br>Distance from departure to destination: 220 NM<br>True track: 175°<br>W/V: 220/10<br>TAS: 135 kts<br><br>What is the distance of the PET from the departure point?,136 NM,116 NM,103 NM,110 NM,2,,
Flight Plan,Given:<br><br>Distance from departure to destination: 340 NM<br>GS Out: 150 kts<br>GS Home: 120 kts<br><br>What is the distance of the PET from the departure point?,272 NM,170 NM,151 NM,189 NM,3,,
Flight Plan,Given:<br><br>Distance from departure to destination: 180 NM<br>Safe Endurance: 2.8 hrs<br>True Track: 065°<br>W/V: 245/25<br>TAS: 100 kts<br><br>What is the distance of the PSR from the departure point?,66 NM,68 NM,131 NM,49 NM,3,,
Flight Plan,"The distance between point of departure and destination is 340 NM and wind velocity in the whole area is 100°/25 kts. TAS is 140 kts,true track is 135° and safe endurance 3 hrs 10 min. How long will it take to reach the point of safe return?",5 hrs 30 min.,1 hrs 49 min.,1 hrs 37 min.,1 hrs 21 min.,2,,
Flight Plan,Find the time to the Point of Safe Return (PSR). Given:<br><br>Maximum usable fuel: 15 000 kg<br>Minimum reserve fuel: 3 500 kg<br>TAS out: 425 kts<br>Headwind component out: 30 kts<br>TAS return: 430 kts<br>Tailwind component return: 20 kts<br>Average fuel flow: 2 150 kg/hr,2 hrs 43 min,2 hrs 51 min,3 hrs 43 min,2 hrs 59 min,2,,
Flight Plan,Given:<br><br>Distance from departure to destination: 400 NM<br>Safe Endurance: 2.5 hrs<br>TAS: 115 kts<br>Ground speed Out: 130 kts<br>Ground speed Home: 105 kts<br><br>What is the distance of the PSR from the departure point?,145 NM,73 NM,179 NM,255 NM,1,,
Flight Plan,Given:<br><br>Distance from departure to destination: 1.100 NM<br>True track: 280°<br>W/V: 100/80<br>TAS: 440 kts<br><br>What is the distance and time of the PET from the departure point?,"Distance: 650 NM; Time: 75 min.","Distance: 450 NM; Time: 52 min.","Distance: 650 NM; Time: 108 min.","Distance: 550 NM; Time: 75 min.",2,,
Flight Plan,Given:<br><br>Distance Q to R: 1760 NM<br>Ground speed OUT: 435 kts<br>Ground speed BACK: 385 kts<br>Safe endurance: 9 hrs<br><br>The distance from Q to the point of safe return (PSR) between Q and R is:,838 NM,642 NM,467 NM,313 NM,1,,
Flight Plan,Given:<br><br>Distance A to B: 1973 NM<br>Ground speed OUT: 430 kts<br>Ground speed BACK: 385 kts<br>Safe endurance: 7 hrs 20 min<br><br>The distance from A to the point of safe return (PSR) is:,1 422 NM,1 664 NM,1 490 NM,1 698 NM,3,,
Flight Plan,Given:<br>X = Distance A to point of equal time (PET) between A and B<br>E = Endurance<br>D = Distance A to B<br>O = Ground speed ON<br>H = Groundspeed BACK<br><br>The formula for calculating the distance X to point of equal time (PET) is:,x = (D Ã— H) / (O + H),x = (D Ã— O Ã— H) / (O + H),x = (E Ã— O Ã— H) / (O + H),x = (D Ã— O) / (O + H),1,,
Flight Plan,Given:<br><br>Distance from departure to destination: 2450 NM<br>Safe Endurance: 7.5 hrs<br>TAS: 410 kts<br>Ground speed out: 360 kts<br>Ground speed home: 460 kts<br><br>What is the time of the PSR from the departure point?,252 min,111 min,198 min,156 min,1,,
Flight Plan,Given:<br><br>Distance from departure to destination: 210 NM<br>Safe Endurance: 3.5 hrs<br>True Track: 310°<br>W/V: 270/30<br>TAS: 120 kts<br><br>What is the distance of the PSR from the departure point?,200 NM,125 NM,100 NM,10 NM,1,,
Flight Plan,Given:<br><br>Distance from departure to destination: 1 345 NM<br>GS Out: 480 kts<br>GS Home: 360 kts<br><br>What is the time of the PET from the departure point?,128 min,96 min,72 min,50 min,3,,
Flight Plan,What kind of endurance is used for PSR calculations?,Alternate endurance.,ATC endurance.,Safe endurance.,Trip endurance.,3,,
Flight Plan,Which of the following statements with regard to the PET (Point of Equal Time) is correct?,The point of equal time is a number which is entered in field 19 of the ATC flight plan.,When calculating the point of equal time fuel reserves should be accounted for.,Endurance is not relevant when calculating the point of equal time.,Endurance is relevant when calculating the point of equal time.,3,,
Flight Plan,Given:<br><br>Distance X to Y: 2700 NM<br>Mach number: 0.75<br>Temperature: -45 °C<br>Mean wind component ON: 10 kts tailwind<br>Mean wind component BACK: 35 kts tailwind<br><br>The distance from X to the point of equal time (PET) between X and Y is:,1 350 NM,1 313 NM,1 386 NM,1 425 NM,3,,
Flight Plan,Given:<br><br>Distance from departure to destination: 150 NM<br>True track: 142°<br>W/V: 200/15<br>TAS: 132 kts<br><br>What is the distance of the PET from the departure point?,71 NM,75 NM,79 NM,134 NM,3,,
Flight Plan,Given:<br>Distance Q to R: 1760 NM<br>Ground speed OUT: 435 kts<br>Ground speed BACK: 385 kts<br><br>The time from Q to the point of equal time (PET) between Q and R is:,110 min.,114 min.,102 min.,106 min.,2,,
Flight Plan,Given:<br><br>Distance from departure to destination: 180 NM<br>Safe Endurance: 2 hrs<br>TAS: 120 kts<br>Ground speed out: 135 kts<br>Ground speed home: 105 kts<br><br>What is the distance and time of the PSR from the departure point?,"Distance: 59 NM;Time: 30 min.","Distance: 118 NM;Time: 53 min.","Distance: 79 NM;Time: 45 min","Distance: 62 NM; Time: 28 min.",2,,
Flight Plan,"From the departure point,the distance to the point of equal time is:",proportional to the sum of ground speed out and ground speed back.,inversely proportional to ground speed back.,inversely proportional to the total distance to go.,inversely proportional to the sum of ground speed out and ground speed back.,4,,
Flight Plan,Given:<br><br>Distance from departure to destination: 2.500 NM<br>GS Out: 540 kts<br>GS Home: 470 kts<br><br>What is the time of the PET from the departure point?,171 min,129 min,149 min,28 min,2,,
Flight Plan,Given:<br><br>Distance from A to B: 2050 NM<br>Mean groundspeed on: 440 kts<br>Mean groundspeed back: 540 kts<br><br>The distance to the point of equal time (PET) between A and B is:,1153 NM,1025 NM,1130 NM,920 NM,3,,
Flight Plan,An aircraft was over A at 14:35 hours flying direct to B. Given:<br><br>Distance A to B: 2.900 NM<br>True airspeed: 470 kts<br>Mean wind component OUT: +55 kts<br>Mean wind component BACK: -75 kts<br><br>The ETA for reaching the point of equal time (PET) between A and B is:,17:44,18:46,17:21,16:57,4,,
Flight Plan,Given:<br><br>Distance from departure to destination: 1 000 NM<br>Safe Endurance: 4 hrs<br>TAS: 500 kts<br>Ground speed out: 550 kts<br>Ground speed home: 450 kts<br><br>What is the distance of the PSR from the departure point?,990 NM,495 NM,10 NM,450 NM,1,,
Flight Plan,An aeroplane is flying at TAS 180 kts on a track of 090°. The W/V is 045°/50 kts. How far can the aeroplane fly out from its base and return in one hour?,56 NM,85 NM,176 NM,88 NM,2,,
Flight Plan,"If CAS is 190 kts,Altitude 9 000 ft. Temp. ISA -10 °C,True Course (TC) 350°,W/V 320/40,distance from departure to destination is 350 NM,endurance 3 hours,and actual time of departure is 1105 UTC. The Point of Equal Time (PET) is reached at:",1 203 UTC,1 213 UTC,1 221 UTC,1 233 UTC,2,,
Flight Plan,Find the distance from waypoint 3 (WP 3) to the critical point. Given:<br>Distance from WP 3 to WP 4: 750 NM<br>TAS out: 430 kts<br>TAS return: 425 kts<br>Tailwind component out: 30 kts<br>Headwind component return: 40 kts,375 NM,408 NM,403 NM,342 NM,4,,
Flight Plan,"On an ATC flight plan,an aircraft indicated as ""H"" for HEAVY:",has a certified Landing Mass greater than or equal to 136 000 kg.,requires a runway length of at least 2000 m at Maximum Certified Take-off Mass.,has a certified Take-Off Mass greater than or equal to 136 000 kg.,has a certified Take-Off Mass greater than or equal to 140 000 lbs.,3,,
Flight Plan,"In the ATS flight plan item 15 (cruising speed),when not expressed as a Mach number,cruising speed is expressed as:",TAS,CAS,ground speed,IAS,1,,
Flight Plan,"On an ATC flight plan,the letter Y is used to indicate that the flight is carried out under the following flight rules:",IFR followed by VFR.,VFR followed by IFR.,VFR.,IFR.,1,,
Flight Plan,"In the appropriate box of a flight plan form,corresponding to the estimated time of departure,the time indicated is that at which the aircraft intends to:",pass the departure beacon.,start-up.,take-off.,go off blocks.,4,,
Flight Plan,"In the ATS flight plan item 13,in a flight plan submitted before departure,the departure time entered is the:",allocated slot time.,estimated off-block time.,estimated take-off time.,estimated time over the first point enroute.,2,,
Flight Plan,"When an ATS flight plan is submitted for a flight outside designated ATS routes,points included in item 15 (route) should not normally be at intervals of more than:",1 hour flying time or 500 km.,30 minutes flying time or 370 km.,15 minutes flying time or 100 km.,20 minutes flying time or 150 km.,2,,
Flight Plan,An aircraft has:<br><br>Maximum Certificated Take-off Mass: 137 000 kg<br>Actual Take-off Mass: 135 000 kg<br><br>Which wake turbulence category should be entered in item 9 of the ATS flight plan?,Medium (M).,Medium/Heavy (M/H).,Heavy (H).,Heavy/Medium (H/M).,3,,
Flight Plan,"In the appropriate box of a flight plan,for endurance,one must indicate the time corresponding to:",the required fuel for the flight plus the alternate and 45 minutes.,the total usable fuel on board minus reserve fuel.,the required fuel for the flight.,the total usable fuel on board.,4,,
Flight Plan,"On an ATC flight plan,to indicate that you will overfly the waypoint TANGO at 350 kts at flight level 280,you will write:",TANGO / K0350 FL280,TANGO / FL280 N0350,TANGO / KT350 F280,TANGO / N0350 F280,4,,
Flight Plan,"The maximum permissible Take-off Mass of an aircraft for the ""L"" wake turbulence category on a flight plan is:",7 000 kg,2 700 kg,10 000 kg,5 700 kg,1,,
Flight Plan,"In the ATC flight plan item 7,for a radio equipped aircraft,the identifier must always:",include the aircraft registration marking.,include an indication of the aircraft type.,include the operating agency designator.,be the RTF callsign to be used.,4,,
Flight Plan,"For the purposes of item 9 (wake turbulence category) of the ATS flight plan,an aircraft with a maximum certificated Take-off Mass of 62 000 kg is:",light (L).,heavy (H).,unclassified (U).,medium (M).,4,,
Flight Plan,If no ICAO identifier has been attributed to an alternate airport (box 16) of a flight plan form:,write ZZZZ in box 16 and indicate in box 18 (additional information) ALTN/ followed by the name of the airport.,write ZZZZ in box 16 and indicate in box 18 (additional information) DEST/ followed by the name of the airport.,write XXXX in box 16 and indicate in box 18 (additional information) ALTN/ followed by the name of the airport.,write XXXX in box 16 and indicate in box 18 (additional information) DEST/ followed by the name of the airport.,1,,
Flight Plan,The navigation plan reads:<br>Trip Fuel: 100 kg<br>Flight time: 1 hr 35 min<br>Taxi fuel: 3 kg<br>Block Fuel: 181 kg<br><br>The endurance on the ICAO flight plan should read:,2 hrs 04 min,1 hr 35 min,2 hrs 52 min,2 hrs 49 min,4,,
Flight Plan,On a flight plan you are required to indicate in the box marked SPEED the planned speed for the first part of the cruise or for the entire cruise. This speed is:,the true airspeed.,the equivalent airspeed.,the estimated ground speed.,the indicated airspeed.,1,,
Flight Plan,"In an ATS flight plan item 15,in order to define a position as a bearing and distance from a VOR,the group of figures should consist of:","full name of VOR,true bearing and distance in kilometres.","VOR ident,magnetic bearing and distance in kilometres.","VOR ident,true bearing and distance in kilometres.","VOR ident,magnetic bearing and distance in nautical miles.",4,,
Flight Plan,"If your destination airport has no ICAO indicator,in the appropriate box of your ATC flight plan,you write:",////,XXXX,AAAA,ZZZZ,4,,
Flight Plan,"In the event that SELCAL is prescribed by an appropriate authority,in which section of the ATS flight plan will the SELCAL code be entered?",Route.,Aircraft identification.,Equipment.,Other information.,4,,
Flight Plan,"In the appropriate box of a flight plan form,concerning equipment,the letter to be used to indicate that the aircraft is equipped with a mode A 4096 codes transponder with altitude reporting capability is:",A,C,P,S,2,,
Flight Plan,"When completing an ATS flight plan for a flight commencing under IFR but possibly changing to VFR,the letters entered in item 8 (flight rules) would be:",Y,X,N/S,G,1,,
Flight Plan,"For an ATC flight plan filed before the flight,the indicated time of departure is:",the estimated off-block time.,the estimated time of take-off.,the time overhead the first reporting point after take-off.,the time at which the flight plan is filed.,1,,
Flight Plan,"In the ATS flight plan,for a non-scheduled flight which of the following letters should be entered in item 8 (type of flight):",N,N/S,X,G,1,,
Flight Plan,Which of the following statements is (are) correct with regard to the operation of flight planning computers?<br>1) The computer can file the ATC flight plan.<br>2) In the event of inflight re-routing the computer produces a new plan.,Neither statement.,Statement 1 only.,Both statements.,Statement 2 only.,2,,
Flight Plan,"On a VFR flight plan,the total estimated time is:","the estimated time from take-off to overhead the destination airport,plus 15 minutes.",the estimated time required from take-off to arrive over the destination airport,the estimated time from take-off to landing at the alternate airport.,the estimated time from engine start to landing at the destination airport.,2,,
Flight Plan,Which of the following statements is (are) correct with regard to the advantages of computer flight plans?<br>1) The computer can file the ATC flight plan.<br>2) Wind data used by the computer is always more up-to-date than that available to the pilot.,Neither statement.,Both statements.,Statement 2 only.,Statement 1 only.,4,,
Flight Plan,"Prior to an IFR flight,when filling in the ICAO flight plan,the time information which should be entered in box 16 ""Total estimated time"" is the time elapsed from:",taxiing until the IAF (Initial Approach Fix) of the destination aerodrome.,take-off until reaching the IAF (Initial Approach Fix) of the destination aerodrome.,taxi-out prior to take-off until taxiing after landing.,take-off until landing.,2,,
Flight Plan,"In the ATS flight plan item 10 (equipment),the letter to indicate the carriage of a serviceable transponder - mode A (4 digits-4096 codes) and mode C,is:",A,P,B,C,4,,
Flight Plan,"When a pilot fills in a flight plan,he/she must indicate the wake turbulence category. This category is a function of which mass?",Actual Take-off Mass.,Maximum certified Take-off Mass.,Actual Landing Mass.,Estimated Take-off Mass.,2,,
Flight Plan,"Which of the following statements is (are) correct with regard to computer flight plans?<br>1) The computer takes account of bad weather on the route and adds extra fuel.<br>2) The computer calculates alternate fuel sufficient for a missed approach,climb,cruise,descent and approach and landing at the destination alternate.",Statement 2 only.,Neither statement.,Statement 1 only.,Both statements.,1,,
Flight Plan,"The ""Estimated Total Time"" in block 16 of a VFR flight plan is the estimated time:",required by the aircraft from take-off to arrive overhead the destination airport.,of endurance at cruising power taking into account pressure and temperature on that day.,required by the aircraft from brake release at take-off until landing.,required by the aircraft from the moment it moves by its own power until it stops at the end of the flight (block time).,1,,
Flight Plan,"When completing an ATS flight plan for a European destination,clock times are to be expressed in:",local mean time.,UTC.,central European time.,local standard time.,2,,
Flight Plan,"In the ATS flight plan item 15,when entering a route for which standard departure (SID) and standard arrival (STAR) procedures exist:",STARS should be entered but not SIDs.,neither SID nor STAR should be entered.,SIDs should be entered but not STARs.,both should be entered in the ATS plan where appropriate.,4,,
Flight Plan,"When completing an ATS flight plan,an elapsed time (item 16) of 1 hrs 55 min should be entered as:",115,115M,1H55,155,4,,
Flight Plan,"In the ATS flight plan item 19,if the number of passengers to be carried is not known when the plan is ready for filing:",an estimate may be entered but that number may not subsequently be exceeded.,"""TBN"" (to be notified) may be entered in the relevant box.",the plan may not be filed until the information is available.,the plan should be filed with the relevant box blank.,2,,
Flight Plan,The cruising speed to write in the appropriate box (15) of an ATS flight plan is:,true airspeed.,indicated airspeed.,calibrated airspeed.,ground speed.,1,,
Flight Plan,"In the ATS flight plan Item 15,a cruising speed of 90 kts will be entered as:",N090,KN090,N0090,090KT,3,,
Flight Plan,The navigation plan reads:<br><br>Trip Fuel: 136 kg<br>Flight time: 2 hrs 45 min<br>Calculated reserve fuel: 30% of Trip Fuel<br><br>Fuel in tank is minimum (no extra fuel on board)<br>Taxi fuel: 3 kg<br><br>The endurance on the ICAO flight plan should read:,3 hrs 38 min,2 hrs 45 min,2 hrs 49 min,3 hrs 34 min,4,,
Flight Plan,An aircraft plans to depart London at 1000 UTC and arrive at Munich (EDDM) at 1215 UTC. In the ATS flight plan Item 16 (destination / EET) should be entered with:,EDDM 1 415.,EDDM 1 215.,EDDM 2H15.,EDDM 215.,4,,
Flight Plan,"For a repetitive flight plan (RPL) to be used,flights must take place on a regular basis on at least:",20 occasions.,30 occasions.,10 occasions.,50 occasions.,3,,
Flight Plan,Repetitive flight plans (RPLs) shall be used for flights operated regularly on the same day(s) of consecutive weeks and:,on at least ten (10) occasions or every day over a period of at least 10 consecutive days.,on at least 20 occasions.,on at least 20 days consecutively.,on at least ten (10) occasions or every day over a period of at least 20 consecutive days,1,,
Flight Plan,"A repetitive flight plan (RPL) is filed for a scheduled flight: Paris Orly to Angouleme,Paris Orly as alternate. Following heavy snow falls,Angouleme airport will be closed at the expected time of arrival. The airline decides before departure to plan a re-routing of that flight to Limoges.",The RPL must be cancelled for that day and a specific flight plan has to be filed.,The pilot-in-command must advise ATC of his intention to divert to Limoges at least 15 minutes before the planned time of arrival.,"The airline's Operations Department has to transmit a change in the RPL at the ATC office,at least half an hour before the planned time of departure.",It is not possible to plan another destination and the flight has to be simply cancelled that day (scheduled flight and not chartered).,1,,
Flight Plan,Change from IFR to VFR will always take place only:,when the aircraft is leaving controlled airspace during VMC.,on the initiative of the aircraft commander.,as instructed by an air traffic control unit.,"at the clearance limit,irrespective of the weather conditions.",2,,
Flight Plan,From the options given below select those flights which require ATC flight plan notification:<br>1) any Public Transport flight.<br>2) any IFR flight.<br>3) any flight which is to be carried out in regions which are designated to ease the provision of the Alerting Service or the operations of Search and Rescue.<br>4) most cross-border flights.<br>5) any flight which involves overflying water.,"2,4","3,4,5","1,5","1,2,3",1,,
Flight Plan,"It is possible,in flight,to:<br>1) file an IFR flight plan.<br>2) modify an active IFR or VFR flight plan.<br>3) cancel an active VFR flight plan.<br>4) close an active VFR flight plan.<br>Which of the following combinations contains all of the correct statements?","1,2,3","1,2,4","1,2,3,4","2,3,4",3,,
Flight Plan,"If a pilot lands at an aerodrome other than the destination aerodrome specified in the flight plan,he must ensure that the ATS unit at the destination aerodrome is informed within a certain number of minutes of his planned ETA at destination. This number of minutes is:",10,45,15,30,4,,
Flight Plan,The appropriate ATS unit has to be informed in case of inadvertent changes from a Flight plan:,if the time estimate for the next reporting point is found to be in error in excess of more than ten minutes from that notified to ATS.,about any deviation in TAS.,if the average TAS at cruising level varies or is expected to vary by Â±5% from that given in the flight plan.,about any track deviation.,3,,
Flight Plan,Changing of flight rules from IFR to VFR is possible:,if instructed by ATC as long as VMC is forecast during the next 60 minutes.,if the commander so requests.,if instructed by ATC as long as VMC is forecast during the next 30 minutes.,only when leaving controlled airspace.,2,,
Flight Plan,"During a flight,a change from instrument flight rules (IFR) to visual flight rules (VFR) is only acceptable,when VFR is permitted in that airspace and when:",the position of the change has been noted on the ATC flight plan. The cancellation of the IFR flight will then be made automatically by ATC.,the PIC has requested and obtained an ATC CLR for the change and has filed a special VFR flight plan.,"the change is initiated by the PIC with a message containing the specific expression ""cancelling my IFR flight"".",ATC invites the PIC to change from IFR to VFR.,3,,
Flight Plan,"In the event of a delay for an uncontrolled flight for which an ATS flight plan has been submitted,the flight plan should be amended or a new ATS flight plan submitted and the old one canceled,when the delay exceeds the:",estimated off-block time by 30 minutes.,estimated off-block time by 60 minutes.,estimated departure time by 30 minutes.,estimated departure time by 60 minutes.,2,,
Flight Plan,How many hours in advance of departure time should a flight plan be filed in the case of flights into areas subject to air traffic flow management (ATFM)?,0:10 hours.,3:00 hours.,1:00 hour.,0:30 hours.,2,,
Flight Plan,An aeroplane is on an IFR flight. The flight is to be changed from IFR to VFR. Is it possible?,"Yes,but only with permission from ATC.","No,you have to remain IFR in accordance to the filed flight plan.","Yes,the pilot in command must inform ATC using the phrase ""cancelling my IFR flight"".","No,only ATC can order you to do this.",3,,
Flight Plan,The planned departure time from the parking area is 1815 UTC. The estimated take-off time is 1825 UTC. The IFR flight plan must be filed with ATC at the latest at:,1715 UTC,1755 UTC,1725 UTC,1745 UTC,1,,
